{
  "schema_version": "mcd-output/1",
  "mcd_id": "MCD3",
  "evaluator_version": "2.0.0",
  "cycle_slot": "2026-09-18T20:55Z",
  "last_closed_bar": {
    "M15": "2026-09-18T20:30Z",
    "M5": "2026-09-18T20:50Z"
  },
  "active_indicator": {
    "M15": "non_b",
    "M5": "best_fit_a"
  },
  "config_hash": {
    "best_fit_a": "d78ed3ba68428d82572684105f89b8a0f822dcee9fa0eb8f909f3fb7b9d1d398",
    "non_b": "dbae8aa6616e612fc7b618fb038a117ba986f1fd7c15f6e6520dab210bbd65cd"
  },
  "status": "VALID",
  "status_reasons": [],
  "state_code": "MCD3_NON_CONSOLIDATED_TREND_CONFLICT",
  "regime_status": "TREND_MISALIGNMENT",
  "bias": "STAND_ASIDE",
  "levels": [
    {
      "name": "UOEDT",
      "tf": "M15",
      "price": 4279.46,
      "role": "resistance"
    },
    {
      "name": "baseline",
      "tf": "M15",
      "price": 4214.17,
      "role": "mid"
    },
    {
      "name": "LOEDT",
      "tf": "M15",
      "price": 4126.24,
      "role": "support"
    },
    {
      "name": "UOEDT",
      "tf": "M5",
      "price": 4384.23,
      "role": "resistance"
    },
    {
      "name": "baseline",
      "tf": "M5",
      "price": 4367.2,
      "role": "mid"
    },
    {
      "name": "LOEDT",
      "tf": "M5",
      "price": 4350.16,
      "role": "support"
    }
  ],
  "depends_on": [
    "MCD1",
    "MCD2"
  ],
  "summary_line": "M15 and M5 trends differ, no consolidated trend",
  "commentary": "The M15 channel slopes down (-29.72\u00b0) while the M5 channel slopes up (+6.94\u00b0), so the two timeframes do not form a consolidated trend and no EDT stochastic is given.",
  "details": {
    "current_bar_engulfed": false,
    "edt_stochastic": null,
    "m15_trend_direction": "DOWN",
    "m5_trend_direction": "UP",
    "nested_bars": 0,
    "nesting_met": false,
    "nesting_window_bars": 754,
    "populated_candidates": {
      "M15": [],
      "M5": [
        "fractal"
      ]
    },
    "trends_aligned": false
  }
}
