{
  "schema_version": "mcd-output/1",
  "mcd_id": "MCD3",
  "evaluator_version": "2.0.0",
  "cycle_slot": "2026-09-28T14:15Z",
  "last_closed_bar": {
    "M15": "2026-09-28T14:00Z",
    "M5": "2026-09-28T14:10Z"
  },
  "active_indicator": {
    "M15": "non_b",
    "M5": "cherry_a"
  },
  "config_hash": {
    "cherry_a": "072eaf426c9f9c25a1a214447a823e4309cfbe263c997934b7c074e91bc60619",
    "non_b": "e4606383683cbd29c053c1bfd9848007732c57581131207478f2de570afdf868"
  },
  "status": "VALID",
  "status_reasons": [],
  "state_code": "MCD3_BEAR_BOTTOM",
  "regime_status": "BEARISH_CONSOLIDATED_OVERSOLD",
  "bias": "NEUTRAL",
  "levels": [
    {
      "name": "UOEDT",
      "tf": "M15",
      "price": 4331.53,
      "role": "resistance"
    },
    {
      "name": "baseline",
      "tf": "M15",
      "price": 4252.81,
      "role": "mid"
    },
    {
      "name": "LOEDT",
      "tf": "M15",
      "price": 4148.18,
      "role": "support"
    },
    {
      "name": "UOEDT",
      "tf": "M5",
      "price": 4289.67,
      "role": "resistance"
    },
    {
      "name": "baseline",
      "tf": "M5",
      "price": 4246.41,
      "role": "mid"
    },
    {
      "name": "LOEDT",
      "tf": "M5",
      "price": 4194.62,
      "role": "support"
    }
  ],
  "depends_on": [
    "MCD1",
    "MCD2"
  ],
  "summary_line": "Consolidated downtrend, lower zone of the M15 corridor",
  "commentary": "Both channels slope down (M15 -15.61\u00b0, M5 -11.01\u00b0). 973 of 1037 closed M5 bars have their corridor inside the M15 corridor, and the latest M5 corridor [4194.62, 4289.67] is inside the M15 corridor [4148.18, 4331.53]. The M15 SSA 4146.30 is below LOEDT; the EDT stochastic is -1.02 (0 at LOEDT, 100 at UOEDT), in the lower zone.",
  "details": {
    "current_bar_engulfed": true,
    "edt_stochastic": -1.02,
    "m15_trend_direction": "DOWN",
    "m5_trend_direction": "DOWN",
    "nested_bars": 973,
    "nesting_met": true,
    "nesting_window_bars": 1037,
    "populated_candidates": {
      "M15": [
        "non_a"
      ],
      "M5": [
        "fractal"
      ]
    },
    "trends_aligned": true
  }
}
