{
  "schema_version": "mcd-output/1",
  "mcd_id": "MCD1",
  "evaluator_version": "2.0.0",
  "cycle_slot": "2026-09-28T23:15Z",
  "last_closed_bar": {
    "M15": "2026-09-28T23:00Z"
  },
  "active_indicator": {
    "M15": "non_b"
  },
  "config_hash": {
    "non_b": "9efbdd7cc2a7866c5f7f6fa76d78a3282823f0c6b034c4f85659be74bdcd84c3"
  },
  "status": "VALID",
  "status_reasons": [],
  "state_code": "MCD1_DOWN_IN_CORRIDOR",
  "regime_status": "TREND_ALIGNED_CONTINUATION",
  "bias": "SHORT",
  "levels": [
    {
      "name": "UOEDT",
      "tf": "M15",
      "price": 4307.72,
      "role": "resistance"
    },
    {
      "name": "baseline",
      "tf": "M15",
      "price": 4214.0,
      "role": "mid"
    },
    {
      "name": "LOEDT",
      "tf": "M15",
      "price": 4103.45,
      "role": "support"
    }
  ],
  "depends_on": [],
  "summary_line": "M15 downtrend, no sustained break of the corridor",
  "commentary": "The M15 channel slopes down (-20.98\u00b0). 102 of the last 102 closed bars closed inside the corridor; the latest closed bar has channel position 0.1071.",
  "details": {
    "channel_position": 0.1071,
    "containment_rate": 93.17,
    "lower_breach_count": 0,
    "n_micro": 102,
    "populated_candidates": {
      "M15": [
        "non_a"
      ]
    },
    "regression_angle_deg": -20.98,
    "trend_direction": "DOWN",
    "upper_breach_count": 0
  }
}
