{
  "schema_version": "mcd-output/1",
  "mcd_id": "MCD2",
  "evaluator_version": "2.0.0",
  "cycle_slot": "2026-09-18T20:55Z",
  "last_closed_bar": {
    "M5": "2026-09-18T20:50Z"
  },
  "active_indicator": {
    "M5": "best_fit_a"
  },
  "config_hash": {
    "best_fit_a": "d78ed3ba68428d82572684105f89b8a0f822dcee9fa0eb8f909f3fb7b9d1d398"
  },
  "status": "VALID",
  "status_reasons": [],
  "state_code": "MCD2_UP_IN_CORRIDOR",
  "regime_status": "TREND_ALIGNED_CONTINUATION",
  "bias": "LONG",
  "levels": [
    {
      "name": "UOEDT",
      "tf": "M5",
      "price": 4384.23,
      "role": "resistance"
    },
    {
      "name": "baseline",
      "tf": "M5",
      "price": 4367.2,
      "role": "mid"
    },
    {
      "name": "LOEDT",
      "tf": "M5",
      "price": 4350.16,
      "role": "support"
    }
  ],
  "depends_on": [],
  "summary_line": "M5 uptrend, inside the corridor",
  "commentary": "The M5 SSA is inside the corridor, between LOEDT 4350.16 and UOEDT 4384.23 (channel position 0.8192), while the channel slopes up (+6.94\u00b0).",
  "details": {
    "channel_position": 0.8192,
    "containment_rate": 55.76,
    "populated_candidates": {
      "M5": [
        "fractal"
      ]
    },
    "regression_angle_deg": 6.94,
    "reversion_setup": false,
    "trend_direction": "UP",
    "window_bars": 288
  }
}
